{
  "pipeline_schema_version": "3.0",
  "submission_id": "sub-1",
  "generated_at": "2026-10-15T00:00:00Z",
  "subject": {
    "question_set": {
      "id": "qs-main",
      "version": "3",
      "content_hash": "sha256:0000000000000000000000000000000000000000000000000000000000000000"
    },
    "lora_a": {
      "id": "lora-a",
      "version": "1.2.0",
      "content_hash": "sha256:0000000000000000000000000000000000000000000000000000000000000000"
    },
    "lora_b": {
      "id": "lora-b",
      "version": "1.0.1",
      "content_hash": "sha256:0000000000000000000000000000000000000000000000000000000000000000"
    }
  },
  "active_release_id": "rel-0001",
  "checks": [
    {
      "kind": "CONTRACT_COMPAT",
      "result": "PASS"
    },
    {
      "kind": "ACCEPTANCE_EVAL",
      "result": "PASS",
      "evidence_ref": "eval-0001"
    }
  ],
  "reports": {
    "LORA_A": "eval-0001"
  },
  "comparisons": [
    {
      "role": "LORA_A",
      "name": "action_accuracy",
      "group": "SAFETY",
      "slice": {
        "kind": "ALL",
        "value": "ALL"
      },
      "candidate": 0.97,
      "candidate_n": 120,
      "baseline": 0.99,
      "baseline_n": 120,
      "delta": -0.02,
      "higher_is_better": true,
      "worse": true
    }
  ],
  "notes": []
}
